Title,$Price
EKD Monogram Cotton Twill Oversized Shirt,$960.00
EKD Monogram Silk Pyjama Shirt,"$1,250.00"
Ice Cream Print Oversized Silk Shirt,"$1,250.00"
Short-sleeve Check Silk Shirt,"$1,250.00"
Short-sleeve Pixel Check Silk Shirt,"$1,290.00"
Short-sleeve Check Silk Shirt,"$1,250.00"
Short-sleeve Monogram Motif Stretch Cotton Shirt,$560.00
Short-sleeve Monogram Motif Stretch Cotton Shirt,$560.00
Embroidered Logo Cotton Slim Fit Shirt,$910.00
Crystal Oak Leaf Cotton Slim Fit Shirt,"$1,650.00"
Monogram Motif Cotton Slim Fit Shirt,$610.00
Monogram Motif Cotton Slim Fit Shirt,$610.00
